{
  "name": "Overhead Dumbbell Triceps Extension (Two Hands)",
  "equipment": [
    "band",
    "cable",
    "dumbbell"
  ],
  "tags": [
    "core",
    "triceps"
  ],
  "cues": [
    "Hold a single dumbbell overhead with both hands, elbows close to your ears",
    "Lower the dumbbell behind your head slowly",
    "Extend elbows to raise the weight back overhead",
    "Keep your upper arms stable throughout",
    "Choose a light-to-moderate dumbbell you can control",
    "Keep your core braced to avoid arching your back",
    "Move slowly and with control",
    "Avoid flaring your elbows outward"
  ],
  "variations": [
    "Seated or standing position",
    "Single-arm triceps extension",
    "Use a resistance band or cable"
  ]
}
