{
  "name": "Hollow Hold",
  "equipment": [
    "dumbbell",
    "ruck"
  ],
  "tags": [
    "core",
    "press"
  ],
  "cues": [
    "Lie on your back, arms extended overhead and legs extended",
    "Press your lower back into the floor",
    "Lift your shoulders and legs slightly off the mat, keeping your core tight",
    "Hold for the prescribed time, breathing steadily",
    "Modify by bending your knees if needed",
    "Keep your lower back pressed into the floor",
    "Focus on quality over duration",
    "Relax your neck and shoulders"
  ],
  "variations": [
    "Weighted Hollow Hold (hold a light dumbbell or ruck)",
    "Alternating arm/leg hollow hold",
    "Hollow rock"
  ]
}
