{
  "name": "Side Plank",
  "equipment": [
    "band",
    "bench"
  ],
  "tags": [
    "conditioning",
    "core",
    "press",
    "row"
  ],
  "cues": [
    "Imagine lengthening from crown of head to heels",
    "Keep shoulders away from ears; press the floor",
    "Slight posterior pelvic tilt to avoid overextending lumbar spine"
  ],
  "safety": "Stop if shoulder joint pain or numbness/tingling occur. Keep alignment tight and pain-free."
}
