{
  "name": "Shoulder Stretch (Hands Clasped Behind Back)",
  "equipment": [
    "bodyweight"
  ],
  "tags": [
    "stretch"
  ],
  "cues": [
    "Stand tall, clasp hands behind your back",
    "Straighten arms and gently lift hands away from your body",
    "Open your chest and squeeze shoulder blades together",
    "Hold for the desired time, breathing deeply",
    "Keep shoulders down and away from ears",
    "Do not force the stretch",
    "Maintain upright posture"
  ],
  "safety": "Stop if you feel pain or pinching in the shoulders."
}
